{
  "schema_version": 1,
  "run_id": "diagnosis_run_615b6a3d768a38c1",
  "app_id": "jm_apparel_cx",
  "fact_snapshot_id": "fact_snapshot_58e05074d59340bd",
  "seed_set_id": "seed_set_b7ef6f28a9934464",
  "created_at": "2026-08-07T08:00:21Z",
  "status": "complete_with_failures",
  "requested_platforms": [
    "豆包",
    "DeepSeek"
  ],
  "probe_ids": [
    "probe_53ce8a4c1c52dcce",
    "probe_2930403ac3c028e1",
    "probe_6922413bc62ad0b9",
    "probe_fa6e144b2989815d",
    "probe_34b51681062f7a88",
    "probe_5cba5ee7dad6a3e2",
    "probe_1ae52ccbd5d71696",
    "probe_41b9ec17aadaafdc",
    "probe_791f44bfeca50938",
    "probe_cff6493abf7ed11e",
    "probe_ad7a636431cd42b4",
    "probe_35c29fb5f282d540",
    "probe_90bcadb1879a9dce",
    "probe_910f4d5b5cb7be31",
    "probe_8c00ef31995b171c",
    "probe_ebc5eee77a865142",
    "probe_868343e571a23be1",
    "probe_f651fb60c1dd0118",
    "probe_c0083fd1c3191b2a",
    "probe_401933669e899e82",
    "probe_66b84275f7429d32",
    "probe_5d3bdc74134f3b2a",
    "probe_59b814a712042c1d",
    "probe_4a78407b51ccb9a3",
    "probe_5f16777758642572",
    "probe_aaa9b511f34a8a97",
    "probe_be1fd0eb14dcf9b0",
    "probe_b90dfa26a1d79f6d",
    "probe_8c420cd1f9c6e67f",
    "probe_a1f1be62d4a0c8fa",
    "probe_5fbc17342d8033f6",
    "probe_15aca38fb426d011",
    "probe_e38d5d98be48a9c0",
    "probe_5bb48c8c8374b98a",
    "probe_4e3d2dcc84142073",
    "probe_2f4c20baca5d983a",
    "probe_23dbaf6f09067b8a",
    "probe_9303265b0d576dc0",
    "probe_c13b0527ff8f9ea4",
    "probe_b84310e469c53788",
    "probe_a3f1ac4a4a5b1b2a",
    "probe_a362d7c0318e5ddf"
  ]
}
